Чудо|Изображение|Время создания|Место|Создатели|Разрушение|Причина|Назначение сооружения
Пирамида Хеопса||XXVI—XXIII век до н. э.|Гиза (Египет)|египтяне[5]|единственное из чудес, сохранившееся до наших дней|единственное из чудес, сохранившееся до наших дней|не известно
Висячие сады Семирамиды||605 г. до н. э.|Вавилон (Ирак, Месопотамия)|были возведены по приказу Навуходоносора II|II в. до н. э.|в 126 году до н. э. разрушены персами.|были созданы для жены царя Навуходоносора II
Статуя Зевса в Олимпии||435 г. до н. э.|Олимпия (Греция)|Фидий|V в.|сгорела в Константинополе во время пожара на Ипподроме в V в.|храмовая статуя в храме Зевса в Олимпии
Храм Артемиды в Эфесе||560 г. до н. э.|Эфес (Турция)|Херсифрон разработал проект Храма и начал его строить. Пеоний и Деметрий закончили строение|370 г. до н. э.356 г. до н. э. (Геростратом)или 262 г. н. э. (готами)|пожар|был построен в честь богини Артемиды
Мавзолей в Галикарнасе||351 г. до н. э.|Галикарнас (на юго-западе Турции)|Пифей|1494 г.|землетрясение; сохранились: фундаменты, архитектурные фрагменты; в Британском музее в Лондоне — статуи Мавсола и его жены Артемисии, рельефы, статуи львов|был возведён как надгробный памятник карийского правителя Мавсола его женой — царицей Артемисией
Колосс Родосский[6]||между 292 и 280 гг. до н. э.|Родос (Греция)|Харес|224 (или 226) г. до н. э.бронзовый корпус был демонтирован в 654 г. н. э.|землетрясение|был установлен скульптором Харесом для увековечивания памяти о победе Родоса над Деметрием Полиоркетом (304 г. до н. э.) .
Александрийский маяк||303 г. до н. э.|Александрия Египетская|греки, династия Птолемеев|XIV в.|землетрясение|Для судоходства.
