№|Unnamed: 1|Децентрализованная администрация|Адм. центр|Входящие периферии|Площадь,км²|Население,чел. (2011)[20]|Плотность,чел./км²|Карта
1.0||Аттика|Афины|Аттика|3808|3 827 624|100515|
2.0||Македония и Фракия|Салоники|Центральная Македония, Восточная Македония и Фракия|32 968|2 490 051|7553|
3.0||Эпир и Западная Македония|Янина|Эпир, Западная Македония|18 654|620 545|3327|
4.0||Фессалия и Центральная Греция|Лариса|Фессалия, Центральная Греция|29 586|1 280 152|4327|
5.0||Пелопоннес, Западная Греция и Ионические острова|Патры|Пелопоннес, Западная Греция, Ионические острова|29 147|1 465 554|5028|
6.0||Эгейские острова|Пирей|Северные Эгейские острова, Южные Эгейские острова|9122|508 206|5571|
7.0||Крит|Ираклион|Крит|8336|623 065|7474|
||Автономное монашеское государство Святой Горы|Карьес|Особый статус и собственный визовый режим|336|2416|720|
||Всего|||131 957|10 815 197|8196|
